{
  "format_version": 2,
  "population": {"model": "negation-b.orm.yaml", "model_id": "urn:gnd-fixture:v70-phase6-negation@1", "source": "fixture", "label": "boundary", "covers": ["candidate", "blocked", "waived", "permitted"]},
  "instances": {},
  "facts": {"candidate": [{"record": "R1"}], "blocked": [], "waived": [{"record": "R1"}], "permitted": [{"record": "R1"}]}
}
